{
  "schema_version": 1,
  "export_kind": "approved-derived-parameter-evidence",
  "packet_id": "synthetic-chapter7-non-empirical",
  "packet_revision": "sha256:cccccccccccccccccccccccccccccccccccccccccccccccccccccccccccccccc",
  "context": {
    "jurisdiction": "SYNTHETIC-NOT-FOR-DECISIONS",
    "payer": "synthetic-payer",
    "budget_boundary": "synthetic-health-budget",
    "service_line": "synthetic-service",
    "price_year": 2026,
    "decision_date": "2026-08-01",
    "implementation_horizon_years": 5,
    "currency_unit": "AUD_2026",
    "health_unit": "QALY"
  },
  "records": [
    {
      "record_id": "n-allocative",
      "role": "n",
      "value": 5.0,
      "unit": "AUD_2026/QALY",
      "programme_id": "synthetic-expansion",
      "evidence_method": "modelled",
      "marginality": "marginal",
      "causal_assumptions": ["Synthetic arithmetic fixture only; no empirical interpretation."],
      "uncertainty": {"kind": "posterior_samples", "samples": [5.0, 6.0]},
      "scale_limits": {"min": 1.0, "max": 20.0},
      "source": {"uri": "https://example.invalid/synthetic/n", "sha256": "aaaaaaaaaaaaaaaaaaaaaaaaaaaaaaaaaaaaaaaaaaaaaaaaaaaaaaaaaaaaaaaa", "licence": "CC0-1.0 synthetic fixture"},
      "transformation": "Hand-authored synthetic conformance values.",
      "reviewer": "synthetic-fixture-review",
      "approval_state": "approved",
      "evidence_revision": "sha256:0000000000000000000000000000000000000000000000000000000000000001",
      "derived_only": true
    },
    {
      "record_id": "n-efficient",
      "role": "n",
      "value": 10.0,
      "unit": "AUD_2026/QALY",
      "programme_id": "synthetic-efficient-expansion",
      "evidence_method": "modelled",
      "marginality": "marginal",
      "causal_assumptions": ["Synthetic equality fixture only; no empirical interpretation."],
      "uncertainty": {"kind": "posterior_samples", "samples": [10.0, 12.0]},
      "scale_limits": {"min": 1.0, "max": 20.0},
      "source": {"uri": "https://example.invalid/synthetic/n-efficient", "sha256": "aaaaaaaaaaaaaaaaaaaaaaaaaaaaaaaaaaaaaaaaaaaaaaaaaaaaaaaaaaaaaaaa", "licence": "CC0-1.0 synthetic fixture"},
      "transformation": "Hand-authored synthetic conformance values.",
      "reviewer": "synthetic-fixture-review",
      "approval_state": "approved",
      "evidence_revision": "sha256:0000000000000000000000000000000000000000000000000000000000000002",
      "derived_only": true
    },
    {
      "record_id": "m-contraction",
      "role": "m",
      "value": 10.0,
      "unit": "AUD_2026/QALY",
      "programme_id": "synthetic-contraction",
      "evidence_method": "modelled",
      "marginality": "marginal",
      "causal_assumptions": ["Synthetic contraction fixture only; no empirical interpretation."],
      "uncertainty": {"kind": "posterior_samples", "samples": [10.0, 12.0]},
      "scale_limits": {"min": 1.0, "max": 20.0},
      "source": {"uri": "https://example.invalid/synthetic/m", "sha256": "aaaaaaaaaaaaaaaaaaaaaaaaaaaaaaaaaaaaaaaaaaaaaaaaaaaaaaaaaaaaaaaa", "licence": "CC0-1.0 synthetic fixture"},
      "transformation": "Hand-authored synthetic conformance values.",
      "reviewer": "synthetic-fixture-review",
      "approval_state": "approved",
      "evidence_revision": "sha256:0000000000000000000000000000000000000000000000000000000000000003",
      "derived_only": true
    },
    {
      "record_id": "d-displacement",
      "role": "d",
      "value": 8.0,
      "unit": "AUD_2026/QALY",
      "programme_id": "synthetic-displacement",
      "evidence_method": "modelled",
      "marginality": "marginal",
      "causal_assumptions": ["Synthetic displacement fixture only; no empirical interpretation."],
      "uncertainty": {"kind": "posterior_samples", "samples": [8.0, 9.0]},
      "scale_limits": {"min": 1.0, "max": 20.0},
      "source": {"uri": "https://example.invalid/synthetic/d", "sha256": "aaaaaaaaaaaaaaaaaaaaaaaaaaaaaaaaaaaaaaaaaaaaaaaaaaaaaaaaaaaaaaaa", "licence": "CC0-1.0 synthetic fixture"},
      "transformation": "Hand-authored synthetic conformance values.",
      "reviewer": "synthetic-fixture-review",
      "approval_state": "approved",
      "evidence_revision": "sha256:0000000000000000000000000000000000000000000000000000000000000004",
      "derived_only": true
    },
    {
      "record_id": "mu-investment",
      "role": "mu",
      "value": 2.0,
      "unit": "AUD_2026/QALY",
      "programme_id": "synthetic-investment",
      "evidence_method": "modelled",
      "marginality": "marginal",
      "causal_assumptions": ["Synthetic investment fixture only; no empirical interpretation."],
      "uncertainty": {"kind": "posterior_samples", "samples": [2.0, 2.4]},
      "scale_limits": {"min": 1.0, "max": 5.0},
      "source": {"uri": "https://example.invalid/synthetic/mu", "sha256": "aaaaaaaaaaaaaaaaaaaaaaaaaaaaaaaaaaaaaaaaaaaaaaaaaaaaaaaaaaaaaaaa", "licence": "CC0-1.0 synthetic fixture"},
      "transformation": "Hand-authored synthetic conformance values.",
      "reviewer": "synthetic-fixture-review",
      "approval_state": "approved",
      "evidence_revision": "sha256:0000000000000000000000000000000000000000000000000000000000000005",
      "derived_only": true
    },
    {
      "record_id": "phi-present-value",
      "role": "phi",
      "value": 3.0,
      "unit": "dimensionless",
      "programme_id": "synthetic-investment",
      "evidence_method": "modelled",
      "marginality": "not_applicable",
      "causal_assumptions": ["Synthetic present-value fixture only; no empirical interpretation."],
      "uncertainty": {"kind": "posterior_samples", "samples": [3.0, 2.5]},
      "scale_limits": {"min": 1.01, "max": 5.0},
      "source": {"uri": "https://example.invalid/synthetic/phi", "sha256": "aaaaaaaaaaaaaaaaaaaaaaaaaaaaaaaaaaaaaaaaaaaaaaaaaaaaaaaaaaaaaaaa", "licence": "CC0-1.0 synthetic fixture"},
      "transformation": "Hand-authored synthetic conformance values.",
      "reviewer": "synthetic-fixture-review",
      "approval_state": "approved",
      "evidence_revision": "sha256:0000000000000000000000000000000000000000000000000000000000000006",
      "derived_only": true
    },
    {
      "record_id": "annual-program-effect",
      "role": "annual_program_health_effect",
      "value": 20.0,
      "unit": "QALY/year",
      "programme_id": "synthetic-investment",
      "evidence_method": "modelled",
      "marginality": "incremental",
      "causal_assumptions": ["Synthetic annual-effect fixture only; no empirical interpretation."],
      "uncertainty": {"kind": "posterior_samples", "samples": [20.0, 20.0]},
      "scale_limits": {"min": 1.0, "max": 50.0},
      "source": {"uri": "https://example.invalid/synthetic/annual-effect", "sha256": "aaaaaaaaaaaaaaaaaaaaaaaaaaaaaaaaaaaaaaaaaaaaaaaaaaaaaaaaaaaaaaaa", "licence": "CC0-1.0 synthetic fixture"},
      "transformation": "Hand-authored synthetic conformance values.",
      "reviewer": "synthetic-fixture-review",
      "approval_state": "approved",
      "evidence_revision": "sha256:0000000000000000000000000000000000000000000000000000000000000007",
      "derived_only": true
    },
    {
      "record_id": "horizon",
      "role": "horizon",
      "value": 5,
      "unit": "year",
      "programme_id": "synthetic-investment",
      "evidence_method": "modelled",
      "marginality": "not_applicable",
      "causal_assumptions": ["Synthetic horizon fixture only; no empirical interpretation."],
      "uncertainty": {"kind": "deterministic", "samples": [5]},
      "scale_limits": {"min": 1, "max": 20},
      "source": {"uri": "https://example.invalid/synthetic/horizon", "sha256": "aaaaaaaaaaaaaaaaaaaaaaaaaaaaaaaaaaaaaaaaaaaaaaaaaaaaaaaaaaaaaaaa", "licence": "CC0-1.0 synthetic fixture"},
      "transformation": "Hand-authored synthetic conformance values.",
      "reviewer": "synthetic-fixture-review",
      "approval_state": "approved",
      "evidence_revision": "sha256:0000000000000000000000000000000000000000000000000000000000000008",
      "derived_only": true
    },
    {
      "record_id": "discount-rate",
      "role": "discount_rate",
      "value": 0.03,
      "unit": "proportion/year",
      "programme_id": "synthetic-investment",
      "evidence_method": "modelled",
      "marginality": "not_applicable",
      "causal_assumptions": ["Synthetic discount fixture only; no empirical interpretation."],
      "uncertainty": {"kind": "deterministic", "samples": [0.03]},
      "scale_limits": {"min": 0.0, "max": 0.1},
      "source": {"uri": "https://example.invalid/synthetic/discount", "sha256": "aaaaaaaaaaaaaaaaaaaaaaaaaaaaaaaaaaaaaaaaaaaaaaaaaaaaaaaaaaaaaaaa", "licence": "CC0-1.0 synthetic fixture"},
      "transformation": "Hand-authored synthetic conformance values.",
      "reviewer": "synthetic-fixture-review",
      "approval_state": "approved",
      "evidence_revision": "sha256:0000000000000000000000000000000000000000000000000000000000000009",
      "derived_only": true
    }
  ]
}
